<?xml version="1.0" encoding="UTF-8"?>
<?xml-stylesheet type="text/xsl" href=""?>
<booklist xmlns:xsi="http://www.w3.org/2001/XMLSchema-instance" xsi:noNamespaceSchemaLocation="file:/C:/Users/sherpa%20trade%20ilam/Desktop/xml%20labreport/number10.xsd">
    <book>
        <title>Web Programming</title>
        <author>Chrisbates</author>
        <publisher>Wiley</publisher>
        <edition>3</edition>
        <price>300</price>
    </book>
    <book>
        <title>Internet world-wide-web</title>
        <author>Ditel</author>
        <publisher>Pearson</publisher>
        <edition>3</edition>
        <price>400</price>
    </book>
    <book>
        <title>Computer Networks</title>
        <author>Foruouzan</author>
        <publisher>Mc Graw Hill</publisher>
        <edition>5</edition>
        <price>700</price>
    </book>
    <book>
        <title>DBMS Concepts</title>
        <author>Navath</author>
        <publisher>Oxford</publisher>
        <edition>5</edition>
        <price>600</price>
    </book>
    <book>
        <title>Linux Programming</title>
        <author>Subhitab Das</author>
        <publisher>Oxford</publisher>
        <edition>8</edition>
        <price>300</price>
    </book>
</booklist>